{"schemaVersion":1,"index":{"name":"Priority Places for Food Index","version":"v2.1","sourceId":"S13","orientation":"Decile 1 = highest priority (most vulnerable to food insecurity) within each nation.","priorityDeciles":[1,2],"measure":"Share of the council's small areas in their nation's two highest-priority deciles (1-2). Small areas, not people: areas have broadly similar populations within each nation.","comparability":"Deciles are set within each nation (about 20 % of a nation's areas are in deciles 1-2), so a council can be compared only with councils in the same nation. Rank councils within their nation; never across nations.","domainsWithoutDataNote":"Not available in Northern Ireland: the Priority Places index has no data for this domain there (the publisher's user guide); Northern Ireland's combined index rests on four domains."},"measures":[{"id":"combined","label":"Combined index"},{"id":"supermarket_proximity","label":"Proximity to supermarkets"},{"id":"supermarket_accessibility","label":"Accessibility of supermarkets"},{"id":"ecommerce_access","label":"Access to online deliveries"},{"id":"socio_demographic","label":"Socio-demographic barriers"},{"id":"nonsupermarket_proximity","label":"Proximity to non-supermarket food provision"},{"id":"food_for_families","label":"Need for family food support"},{"id":"fuel_poverty","label":"Fuel poverty"}],"nations":[{"nation":"England","councils":296,"areas":33755,"areaType":"LSOA (2021)","assignment":"ONS LSOA (2021) to LAD (2025) best-fit lookup (S15)","priorityAreas":6751,"domainsWithoutData":[]},{"nation":"Wales","councils":22,"areas":1917,"areaType":"LSOA (2021)","assignment":"ONS LSOA (2021) to LAD (2025) best-fit lookup (S15)","priorityAreas":384,"domainsWithoutData":[]},{"nation":"Scotland","councils":32,"areas":6976,"areaType":"Data Zone (2011)","assignment":"Scottish Government 2011 Data Zone lookup, current councils (S32)","priorityAreas":1396,"domainsWithoutData":[]},{"nation":"Northern Ireland","councils":11,"areas":890,"areaType":"Super Output Area (2011)","assignment":"NIMDM 2017 council (LGD 2014) of each SOA (S19)","priorityAreas":178,"domainsWithoutData":["supermarket_accessibility","ecommerce_access","fuel_poverty"]}],"councils":[{"code":"E06000001","name":"Hartlepool","nation":"England","areas":57,"combinedDeciles":[12,7,6,4,9,6,5,6,2,0],"values":{"combined":{"priority":19,"areas":57},"supermarket_proximity":{"priority":2,"areas":57},"supermarket_accessibility":{"priority":0,"areas":57},"ecommerce_access":{"priority":48,"areas":57},"socio_demographic":{"priority":28,"areas":57},"nonsupermarket_proximity":{"priority":1,"areas":57},"food_for_families":{"priority":57,"areas":57},"fuel_poverty":{"priority":18,"areas":57}}},{"code":"E06000002","name":"Middlesbrough","nation":"England","areas":90,"combinedDeciles":[6,15,9,9,14,18,9,6,3,1],"values":{"combined":{"priority":21,"areas":90},"supermarket_proximity":{"priority":12,"areas":90},"supermarket_accessibility":{"priority":0,"areas":90},"ecommerce_access":{"priority":84,"areas":90},"socio_demographic":{"priority":48,"areas":90},"nonsupermarket_proximity":{"priority":2,"areas":90},"food_for_families":{"priority":90,"areas":90},"fuel_poverty":{"priority":42,"areas":90}}},{"code":"E06000003","name":"Redcar and Cleveland","nation":"England","areas":88,"combinedDeciles":[20,13,12,9,8,5,7,5,6,3],"values":{"combined":{"priority":33,"areas":88},"supermarket_proximity":{"priority":17,"areas":88},"supermarket_accessibility":{"priority":2,"areas":88},"ecommerce_access":{"priority":80,"areas":88},"socio_demographic":{"priority":27,"areas":88},"nonsupermarket_proximity":{"priority":3,"areas":88},"food_for_families":{"priority":58,"areas":88},"fuel_poverty":{"priority":22,"areas":88}}},{"code":"E06000004","name":"Stockton-on-Tees","nation":"England","areas":124,"combinedDeciles":[7,11,12,20,16,14,13,11,10,10],"values":{"combined":{"priority":18,"areas":124},"supermarket_proximity":{"priority":7,"areas":124},"supermarket_accessibility":{"priority":0,"areas":124},"ecommerce_access":{"priority":91,"areas":124},"socio_demographic":{"priority":35,"areas":124},"nonsupermarket_proximity":{"priority":5,"areas":124},"food_for_families":{"priority":102,"areas":124},"fuel_poverty":{"priority":25,"areas":124}}},{"code":"E06000005","name":"Darlington","nation":"England","areas":66,"combinedDeciles":[6,8,10,4,12,9,6,3,7,1],"values":{"combined":{"priority":14,"areas":66},"supermarket_proximity":{"priority":6,"areas":66},"supermarket_accessibility":{"priority":1,"areas":66},"ecommerce_access":{"priority":48,"areas":66},"socio_demographic":{"priority":20,"areas":66},"nonsupermarket_proximity":{"priority":4,"areas":66},"food_for_families":{"priority":58,"areas":66},"fuel_poverty":{"priority":18,"areas":66}}},{"code":"E06000006","name":"Halton","nation":"England","areas":80,"combinedDeciles":[26,18,5,4,8,2,5,5,3,4],"values":{"combined":{"priority":44,"areas":80},"supermarket_proximity":{"priority":19,"areas":80},"supermarket_accessibility":{"priority":10,"areas":80},"ecommerce_access":{"priority":18,"areas":80},"socio_demographic":{"priority":30,"areas":80},"nonsupermarket_proximity":{"priority":4,"areas":80},"food_for_families":{"priority":55,"areas":80},"fuel_poverty":{"priority":30,"areas":80}}},{"code":"E06000007","name":"Warrington","nation":"England","areas":132,"combinedDeciles":[0,8,12,13,16,17,15,14,18,19],"values":{"combined":{"priority":8,"areas":132},"supermarket_proximity":{"priority":24,"areas":132},"supermarket_accessibility":{"priority":7,"areas":132},"ecommerce_access":{"priority":9,"areas":132},"socio_demographic":{"priority":16,"areas":132},"nonsupermarket_proximity":{"priority":9,"areas":132},"food_for_families":{"priority":0,"areas":132},"fuel_poverty":{"priority":22,"areas":132}}},{"code":"E06000008","name":"Blackburn with Darwen","nation":"England","areas":91,"combinedDeciles":[16,24,11,14,6,9,7,2,1,1],"values":{"combined":{"priority":40,"areas":91},"supermarket_proximity":{"priority":11,"areas":91},"supermarket_accessibility":{"priority":12,"areas":91},"ecommerce_access":{"priority":36,"areas":91},"socio_demographic":{"priority":38,"areas":91},"nonsupermarket_proximity":{"priority":3,"areas":91},"food_for_families":{"priority":57,"areas":91},"fuel_poverty":{"priority":43,"areas":91}}},{"code":"E06000009","name":"Blackpool","nation":"England","areas":94,"combinedDeciles":[8,10,19,19,14,7,11,3,3,0],"values":{"combined":{"priority":18,"areas":94},"supermarket_proximity":{"priority":0,"areas":94},"supermarket_accessibility":{"priority":0,"areas":94},"ecommerce_access":{"priority":27,"areas":94},"socio_demographic":{"priority":43,"areas":94},"nonsupermarket_proximity":{"priority":0,"areas":94},"food_for_families":{"priority":87,"areas":94},"fuel_poverty":{"priority":45,"areas":94}}},{"code":"E06000010","name":"Kingston upon Hull, City of","nation":"England","areas":168,"combinedDeciles":[10,14,15,24,18,24,22,24,11,6],"values":{"combined":{"priority":24,"areas":168},"supermarket_proximity":{"priority":0,"areas":168},"supermarket_accessibility":{"priority":0,"areas":168},"ecommerce_access":{"priority":76,"areas":168},"socio_demographic":{"priority":89,"areas":168},"nonsupermarket_proximity":{"priority":0,"areas":168},"food_for_families":{"priority":168,"areas":168},"fuel_poverty":{"priority":90,"areas":168}}},{"code":"E06000011","name":"East Riding of Yorkshire","nation":"England","areas":213,"combinedDeciles":[2,5,4,13,26,18,31,25,51,38],"values":{"combined":{"priority":7,"areas":213},"supermarket_proximity":{"priority":68,"areas":213},"supermarket_accessibility":{"priority":65,"areas":213},"ecommerce_access":{"priority":61,"areas":213},"socio_demographic":{"priority":20,"areas":213},"nonsupermarket_proximity":{"priority":97,"areas":213},"food_for_families":{"priority":0,"areas":213},"fuel_poverty":{"priority":23,"areas":213}}},{"code":"E06000012","name":"North East Lincolnshire","nation":"England","areas":107,"combinedDeciles":[8,11,15,12,14,18,10,13,4,2],"values":{"combined":{"priority":19,"areas":107},"supermarket_proximity":{"priority":15,"areas":107},"supermarket_accessibility":{"priority":1,"areas":107},"ecommerce_access":{"priority":94,"areas":107},"socio_demographic":{"priority":40,"areas":107},"nonsupermarket_proximity":{"priority":11,"areas":107},"food_for_families":{"priority":100,"areas":107},"fuel_poverty":{"priority":42,"areas":107}}},{"code":"E06000013","name":"North Lincolnshire","nation":"England","areas":103,"combinedDeciles":[13,14,20,15,17,8,7,8,1,0],"values":{"combined":{"priority":27,"areas":103},"supermarket_proximity":{"priority":39,"areas":103},"supermarket_accessibility":{"priority":26,"areas":103},"ecommerce_access":{"priority":41,"areas":103},"socio_demographic":{"priority":16,"areas":103},"nonsupermarket_proximity":{"priority":29,"areas":103},"food_for_families":{"priority":5,"areas":103},"fuel_poverty":{"priority":24,"areas":103}}},{"code":"E06000014","name":"York","nation":"England","areas":121,"combinedDeciles":[0,0,1,0,5,7,14,22,25,47],"values":{"combined":{"priority":0,"areas":121},"supermarket_proximity":{"priority":20,"areas":121},"supermarket_accessibility":{"priority":4,"areas":121},"ecommerce_access":{"priority":5,"areas":121},"socio_demographic":{"priority":9,"areas":121},"nonsupermarket_proximity":{"priority":14,"areas":121},"food_for_families":{"priority":0,"areas":121},"fuel_poverty":{"priority":7,"areas":121}}},{"code":"E06000015","name":"Derby","nation":"England","areas":152,"combinedDeciles":[12,26,21,20,19,14,17,9,8,6],"values":{"combined":{"priority":38,"areas":152},"supermarket_proximity":{"priority":5,"areas":152},"supermarket_accessibility":{"priority":2,"areas":152},"ecommerce_access":{"priority":28,"areas":152},"socio_demographic":{"priority":43,"areas":152},"nonsupermarket_proximity":{"priority":0,"areas":152},"food_for_families":{"priority":35,"areas":152},"fuel_poverty":{"priority":52,"areas":152}}},{"code":"E06000016","name":"Leicester","nation":"Engla